{
  "schema_id": "knowledge.experience-spec",
  "schema_version": 1,
  "experience_id": "fcv-literature-corpus",
  "title": "FCV literature — Eric Mvukiyehe seed corpus",
  "collection_spec": "collection.json",
  "renderer": "static-navigator",
  "visibility": "private",
  "capabilities": {
    "search": true,
    "facets": ["author"]
  },
  "navigation": {
    "default_sort": "title"
  }
}
