{
  "schema_id": "knowledge.experience-spec",
  "schema_version": 1,
  "experience_id": "lcd-thesis-resources-live",
  "title": "LCD — thesis resources",
  "collection_spec": "lcd.collection.json",
  "renderer": "static-navigator",
  "visibility": "public",
  "capabilities": {
    "search": true,
    "facets": [
      "entity_type"
    ]
  },
  "navigation": {
    "default_sort": "title"
  }
}
